<?xml version="1.0" standalone="yes"?>
<xs:schema id="instructionSeq" xmlns="" xmlns:xs="http://www.w3.org/2001/XMLSchema" xmlns:msdata="urn:schemas-microsoft-com:xml-msdata">
  <xs:element name="instructionSeq" msdata:IsDataSet="true" msdata:UseCurrentLocale="true">
    <xs:complexType>
      <xs:choice minOccurs="0" maxOccurs="unbounded">
        <xs:element name="instructions">
          <xs:complexType>
            <xs:sequence>
              <xs:element name="instruction" minOccurs="0" maxOccurs="unbounded">
                <xs:complexType>
                  <xs:sequence>
                    <xs:element name="description" type="xs:string" minOccurs="0" />
                    <xs:element name="id" type="xs:string" minOccurs="0" />
                    <xs:element name="actions" minOccurs="0" maxOccurs="unbounded">
                      <xs:complexType>
                        <xs:sequence>
                          <xs:element name="action" minOccurs="0" maxOccurs="unbounded">
                            <xs:complexType>
                              <xs:sequence>
                                <xs:element name="name" type="xs:string" minOccurs="0" />
                                <xs:element name="command" type="xs:string" minOccurs="0" />
                                <xs:element name="resources" minOccurs="0" maxOccurs="unbounded">
                                  <xs:complexType>
                                    <xs:sequence>
                                      <xs:element name="operators" minOccurs="0" maxOccurs="unbounded">
                                        <xs:complexType>
                                          <xs:sequence>
                                            <xs:element name="operator" minOccurs="0" maxOccurs="unbounded">
                                              <xs:complexType>
                                                <xs:sequence>
                                                  <xs:element name="employeeRefID" type="xs:string" minOccurs="0" />
                                                </xs:sequence>
                                              </xs:complexType>
                                            </xs:element>
                                          </xs:sequence>
                                        </xs:complexType>
                                      </xs:element>
                                      <xs:element name="machine" minOccurs="0" maxOccurs="unbounded">
                                        <xs:complexType>
                                          <xs:sequence>
                                            <xs:element name="toolRefID" type="xs:string" minOccurs="0" />
                                            <xs:element name="method" type="xs:string" minOccurs="0" />
                                            <xs:element name="quantity" type="xs:string" minOccurs="0" />
                                          </xs:sequence>
                                        </xs:complexType>
                                      </xs:element>
                                      <xs:element name="itemsToAssemble" minOccurs="0" maxOccurs="unbounded">
                                        <xs:complexType>
                                          <xs:sequence>
                                            <xs:element name="item" minOccurs="0" maxOccurs="unbounded">
                                              <xs:complexType>
                                                <xs:sequence>
                                                  <xs:element name="itemRefID" type="xs:string" minOccurs="0" />
                                                  <xs:element name="Quanity" type="xs:string" minOccurs="0" />
                                                  <xs:element name="quantity" type="xs:string" minOccurs="0" />
                                                </xs:sequence>
                                              </xs:complexType>
                                            </xs:element>
                                          </xs:sequence>
                                        </xs:complexType>
                                      </xs:element>
                                    </xs:sequence>
                                  </xs:complexType>
                                </xs:element>
                                <xs:element name="endItem" minOccurs="0" maxOccurs="unbounded">
                                  <xs:complexType>
                                    <xs:sequence>
                                      <xs:element name="id" type="xs:string" minOccurs="0" />
                                      <xs:element name="name" type="xs:string" minOccurs="0" />
                                      <xs:element name="targetPos" type="xs:string" minOccurs="0" />
                                    </xs:sequence>
                                  </xs:complexType>
                                </xs:element>
                              </xs:sequence>
                            </xs:complexType>
                          </xs:element>
                        </xs:sequence>
                      </xs:complexType>
                    </xs:element>
                  </xs:sequence>
                </xs:complexType>
              </xs:element>
            </xs:sequence>
          </xs:complexType>
        </xs:element>
      </xs:choice>
    </xs:complexType>
  </xs:element>
</xs:schema>